{
  "activation": {
    "activation_scope": {
      "allowed_ops": {
        "commit": false,
        "edit": false,
        "network": false,
        "push": false
      },
      "allowed_paths": [],
      "expires_at": "run_terminal",
      "step_budget": 1
    },
    "activation_source": "human_ui",
    "activation_status": "approved",
    "activation_version": "1",
    "approved_at": "2026-01-01T00:00:00+0000",
    "approved_by": "human_ui_action",
    "classification_provenance": {
      "confidence": 1.0,
      "evidence_refs": [
        "e2e-harness-fixture"
      ],
      "selector_threshold": 0.85,
      "source": "deterministic_fixture",
      "tie_break": "deterministic_status_order:selected_waiting_human_blocked"
    },
    "context_scope": {
      "mode": "bounded_refs",
      "raw_transcript_sharing": "forbidden",
      "refs": [
        ".tmp/e2e-harness-fixture/ref.md"
      ]
    },
    "next_action": "create_workflow_run",
    "workflow_selection": {
      "initial_step": "review",
      "optional_expansions": [],
      "publication_gate_required": false,
      "required_gates": [
        "entry.activation_approved",
        "entry.work_order_valid",
        "exit.typed_report_valid"
      ],
      "required_safety_class": "readonly",
      "safety_class": "readonly",
      "status": "selected",
      "workflow_id": "single_step_external_review"
    }
  },
  "approved_provider_binding": {
    "default_model": "claude-sonnet-4-6",
    "effective_model_policy": "required_exact_match",
    "provider_adapter_id": "claude_headless_p0"
  },
  "context_sharing": {
    "provider_transcript": "confined_evidence_path_only",
    "shared_run_state": "typed_durable_state",
    "step_local_snapshot": "immutable_step_attempt_snapshot"
  },
  "current_step": "review",
  "goal_state": "complete",
  "iteration": 1,
  "max_steps": 1,
  "provider_execution": {
    "adapter_id": "claude_headless_p0",
    "adapter_request_digest": "sha256:13a4da50505756b9344dbd4654a6bfbe6768b0dd4b94eba5094d7f1715b9ba17",
    "attempt_id": "provider-attempt-fixture",
    "attempt_number": 1,
    "context_snapshot_digest": "sha256:f851b6dce01abee1ca13f830b7b7559222a7908e718836a8601c580c33ed2660",
    "execution_version": "1",
    "last_outcome": {
      "attempt_result_path": "__STATE_ROOT__/provider-evidence/run-stale-lock/attempts/provider-attempt-861432e069d9fea2f7a37dc0c939cfd7-result.json",
      "evidence_path": "__STATE_ROOT__/provider-evidence/run-stale-lock/review-provider-evidence.json",
      "reason_class": "ok",
      "recorded_at": "2026-01-01T00:00:00+0000",
      "transcript_path": "__STATE_ROOT__/provider-evidence/run-stale-lock/review-provider-transcript.json"
    },
    "lease": {
      "claimed_at": "2026-01-01T00:00:00+0000",
      "claimed_by": {
        "authn_method": "local_test",
        "principal_id": "e2e-harness",
        "principal_type": "harness_runner"
      },
      "last_heartbeat_at": "2026-01-01T00:00:00+0000",
      "lease_expires_at": "2026-01-01T00:00:00+0000",
      "lease_id": "provider-lease-fixture"
    },
    "phase": "completed",
    "provider_binding": {
      "effective_model_policy": "required_exact_match",
      "intended_model": "claude-sonnet-4-6",
      "provider_adapter_id": "claude_headless_p0"
    },
    "retry": {
      "auto_retries_used": 0,
      "consecutive_failures": 0,
      "last_failure_fingerprint": null,
      "max_auto_retries": 5
    },
    "step_id": "review",
    "timeout_seconds": 1800,
    "work_order_digest": "sha256:f5c8ab51ada211a288ab229b37f050137cb858cebc0bdff6f259e8ba657ac8ae"
  },
  "request_id": "req-stale-lock",
  "requester": {
    "chat_session_id": "harness",
    "frontdoor": "codex"
  },
  "run_id": "run-stale-lock",
  "run_state": "complete",
  "run_version": "1",
  "scheduling": {
    "concurrency": 1,
    "concurrency_group": "global",
    "lock_policy": "global_advisory_lock",
    "resume_policy": "manual",
    "scheduler_mode": "invocation-drain",
    "state_persistence": "durable_state"
  },
  "step_history": [
    {
      "principal": {
        "authn_method": "local_cli",
        "principal_id": "manual-cli",
        "principal_type": "manual_operator"
      },
      "queued_at": "2026-01-01T00:00:00+0000",
      "signature": {
        "algorithm": "sha256-hmac-sha256-local-principal-key",
        "signature": "sha256:ecad0955a5b9108eb523798b18fd4967429fa69fb821fe1adf4ad7cb2554911d",
        "signed_at": "2026-01-01T00:00:00+0000"
      },
      "status": "queued",
      "step_id": "review",
      "work_order_path": "__STATE_ROOT__/work-orders/run-stale-lock/review.json"
    },
    {
      "checked_at": "2026-01-01T00:00:00+0000",
      "outcome": "report_valid",
      "principal": {
        "authn_method": "local_test",
        "principal_id": "e2e-harness",
        "principal_type": "harness_runner"
      },
      "report_path": "__STATE_ROOT__/reports/run-stale-lock/review-external-review-report.json",
      "result": "pass",
      "signature": {
        "algorithm": "sha256-local-principal-key",
        "signature": "sha256:6af1c11e82f8dac4097d03f6eb162c841a9d367140b9595edcd42f7ae823a76f",
        "signed_at": "2026-01-01T00:00:00+0000"
      },
      "status": "complete",
      "step_id": "review"
    }
  ],
  "task_id": "TSK-PENDING-stale-lock",
  "terminal": {
    "reason": "report_valid",
    "status": "complete"
  },
  "transition_provenance": [
    {
      "principal": {
        "authn_method": "local_cli",
        "principal_id": "manual-cli",
        "principal_type": "manual_operator"
      },
      "signature": {
        "algorithm": "sha256-hmac-sha256-local-principal-key",
        "signature": "sha256:9dbb28a1f603c526d14965d6ebf58dd4ec93fa996eb4b19c552a7b5a241c250a",
        "signed_at": "2026-01-01T00:00:00+0000"
      },
      "transition": "create_run"
    },
    {
      "principal": {
        "authn_method": "local_cli",
        "principal_id": "manual-cli",
        "principal_type": "manual_operator"
      },
      "signature": {
        "algorithm": "sha256-hmac-sha256-local-principal-key",
        "signature": "sha256:a279afb66d43f8d1dd20f07aa754a95d76135ca45309f874c6a209a7d91204ea",
        "signed_at": "2026-01-01T00:00:00+0000"
      },
      "transition": "drain_run"
    },
    {
      "outcome": "report_valid",
      "principal": {
        "authn_method": "local_test",
        "principal_id": "e2e-harness",
        "principal_type": "harness_runner"
      },
      "result": "complete",
      "signature": {
        "algorithm": "sha256-local-principal-key",
        "signature": "sha256:acffe985fa43e9a0efe0f81b560d35fb85d414a97f423292a26e7c2670e66965",
        "signed_at": "2026-01-01T00:00:00+0000"
      },
      "transition": "validate_report"
    }
  ],
  "transitions": [
    {
      "artifact_refs": [
        "__STATE_ROOT__/work-orders/run-stale-lock/review.json",
        "__STATE_ROOT__/work-orders/run-stale-lock/review-snapshot-1.json"
      ],
      "from_state": "created",
      "occurred_at": "2026-01-01T00:00:00+0000",
      "principal": {
        "authn_method": "local_cli",
        "principal_id": "manual-cli",
        "principal_type": "manual_operator"
      },
      "reason_class": "step_queued",
      "run_id": "run-stale-lock",
      "seq": 1,
      "signature": {
        "algorithm": "sha256-local-principal-key",
        "signature": "sha256:47f6ceac8a4b393fd577104dc3a1d9401ec59e0c68499d7d30689957c816db98",
        "signed_at": "2026-01-01T00:00:00+0000"
      },
      "to_state": "step_queued",
      "transition": "drain_run",
      "transition_version": "1"
    },
    {
      "artifact_refs": [
        "__STATE_ROOT__/work-orders/run-stale-lock/review.json",
        "__STATE_ROOT__/work-orders/run-stale-lock/review-snapshot-1.json",
        "__STATE_ROOT__/adapter-requests/run-stale-lock/review-claude_headless_p0.json"
      ],
      "from_state": "step_queued",
      "occurred_at": "2026-01-01T00:00:00+0000",
      "principal": {
        "authn_method": "local_test",
        "principal_id": "e2e-harness",
        "principal_type": "harness_runner"
      },
      "reason_class": "provider_claimed",
      "run_id": "run-stale-lock",
      "seq": 2,
      "signature": {
        "algorithm": "sha256-local-principal-key",
        "signature": "sha256:b1205f80df9c6ac65283000d82ac44184edb45aebb67c516b109bfd07bb97314",
        "signed_at": "2026-01-01T00:00:00+0000"
      },
      "to_state": "waiting_provider",
      "transition": "run_provider",
      "transition_version": "1"
    },
    {
      "artifact_refs": [
        "__STATE_ROOT__/reports/run-stale-lock/review-external-review-report.json"
      ],
      "from_state": "waiting_provider",
      "occurred_at": "2026-01-01T00:00:00+0000",
      "principal": {
        "authn_method": "local_test",
        "principal_id": "e2e-harness",
        "principal_type": "harness_runner"
      },
      "reason_class": "report_received",
      "run_id": "run-stale-lock",
      "seq": 3,
      "signature": {
        "algorithm": "sha256-local-principal-key",
        "signature": "sha256:3dd3f4c547f292ea214dba1f5c2cfb49e812a28e64b77e6ccd6f1a93043c35f0",
        "signed_at": "2026-01-01T00:00:00+0000"
      },
      "to_state": "validating",
      "transition": "validate_report",
      "transition_version": "1"
    },
    {
      "artifact_refs": [
        "__STATE_ROOT__/reports/run-stale-lock/review-external-review-report.json"
      ],
      "from_state": "validating",
      "occurred_at": "2026-01-01T00:00:00+0000",
      "principal": {
        "authn_method": "local_test",
        "principal_id": "e2e-harness",
        "principal_type": "harness_runner"
      },
      "reason_class": "report_valid",
      "run_id": "run-stale-lock",
      "seq": 4,
      "signature": {
        "algorithm": "sha256-local-principal-key",
        "signature": "sha256:29b04c74c270a0abc8b18dce8ae562d785f0b2c3517d88fbbc26a6dbe8e5afaf",